{"status":"done","branch":"codex/w2a-roster-import","commit":"b64dab50eb7f07efca84d564e24eee4975b2a87a","files_changed":["src/app/admin/events/[eventId]/attorneys/attorney-manage-dialog.tsx","src/app/admin/events/[eventId]/attorneys/attorney-search.tsx","src/app/admin/events/[eventId]/attorneys/page.tsx","src/app/admin/events/[eventId]/roster-import/api/route.ts","src/app/admin/events/[eventId]/roster-import/page.tsx","src/app/admin/events/[eventId]/roster-import/roster-import-client.tsx","src/app/portal/schedule/data.ts","src/app/portal/schedule/review/page.tsx","src/components/attorney-picker.tsx","src/lib/roster-import/company-safe-projection.test.ts","src/lib/roster-import/company-safe-projection.ts","src/lib/roster-import/normalize.ts","src/lib/roster-import/service.test.ts","src/lib/roster-import/service.ts","src/lib/roster-import/types.ts","src/lib/roster-import/validator.test.ts","src/lib/roster-import/validator.ts","src/lib/roster-import/workbook.test.ts","src/lib/roster-import/workbook.ts"],"verify_cmd":"npm run lint && npx tsc --noEmit && npm test && npm run build; COUNSEL_TEST_ENV_FILE=/Users/thingy/Documents/Codex/2026-09-03/github-plugin-github-openai-curated-remote/work/release-preflight/.env.w2-import.local npm test","verify_result":{"passed":true,"output_tail":"Lint, strict TypeScript, production build, and all 17 localhost-database tests passed. Live HTTP checks accepted a 1,207,560-byte/2,100-row upload, rejected 5,242,881 bytes with a useful 400 error, and confirmed the company projection exposes the resume reference without private sentinels. CodeRabbit reviewed the staged diff; its valid cumulative multi-sheet row-cap finding was fixed. Worktree is clean."},"blockers":["practice-areas.ts API found: parsePracticeAreas(value, { percentageFormat: 'auto' | 'fraction' | 'whole' }) returns ParsedPracticeAreas; serializePracticeAreas(entries) returns SerializedPracticeAreaEntry[]. serializePracticeAreas emits percentScale: 'whole' for every percentage, so explicit whole-scale writes are supported.","Acceptance cases not exercised: none.","Foundation columns missing or additionally needed: none."]}