{"status":"done","branch":"codex/w1b-attorney-auth","commit":"0f236a039b2fef448bac179f39d743deff6d5f7a","files_changed":["drizzle/0001_attorney_magic_link_auth.sql","src/app/attorney/auth.ts","src/app/attorney/callback/route.ts","src/app/attorney/login/page.tsx","src/app/attorney/login/request/route.ts","src/app/attorney/logout/route.ts","src/app/attorney/page.tsx","src/lib/auth.ts","src/lib/db/schema.ts","src/lib/email/capture.ts","src/lib/email/index.ts","src/lib/email/resend.ts","src/lib/email/types.ts","src/lib/session.ts","src/proxy.ts"],"verify_cmd":"npm run lint && npx tsc --noEmit","verify_result":{"passed":true,"output_tail":"ESLint and TypeScript passed. Next.js production build passed against the disposable local database. Local integration passed two-process throttling, restart persistence, 10-way atomic token consumption, event binding, expiry, ambiguity refusal, capture delivery, and production fail-closed checks. Final CodeRabbit review reported zero findings."},"blockers":["Required production environment keys: DATABASE_URL, ATTORNEY_SESSION_SECRET, NEXT_PUBLIC_APP_URL, RESEND_API_KEY, ATTORNEY_EMAIL_FROM.","Real Resend delivery was not verified because no provider credentials or approved test recipient were available; no real email was sent.","Root's pre-existing docs/campaign-hq/schemas/worker-result.json modification remains uncommitted and was excluded from the feature commit."]}