{"status":"done","branch":"codex/w1c-scheduling","commit":"925dab340d49cf3be9d688760719af903a14ebc2","files_changed":["src/app/admin/events/[eventId]/assignments/actions.ts","src/app/api/attorneys/[id]/resume/route.ts","src/app/portal/interviewers/actions.ts","src/app/portal/schedule/actions.ts","src/app/portal/schedule/data.ts","src/app/portal/schedule/interviewer-controls.tsx","src/app/portal/schedule/page.tsx","src/app/portal/schedule/practice-display.ts","src/app/portal/schedule/review/page.tsx","src/app/portal/schedule/schedule-grid.tsx","src/components/attorney-picker.tsx"],"verify_cmd":"npm run lint && npx tsc --noEmit","verify_result":{"passed":true,"output_tail":"Lint and TypeScript passed cleanly. Isolated PostgreSQL security integration checks passed for concurrent conflicts, atomic update preservation, ownership/event scoping, closed-event controls, delete-and-rebook, resume access, and percentage normalization. Configured Next.js production build passed. Final CodeRabbit review returned zero findings."},"blockers":["Slot-release decision: removal performs one ownership- and open-event-scoped DELETE, not status='cancelled', so both unconditional unique constraints are genuinely released.","Not exercised here: write/race testing through an actual Neon HTTP test database or signed-in browser inspection of HTML/RSC/network payloads. These remain release acceptance checks; no production database was mutated.","Root's pre-existing docs/campaign-hq/schemas/worker-result.json modification remains unstaged and was excluded from the commit."]}