{"status":"done","branch":"codex/w2-foundation","commit":"1bdc6872543c6924d13f709ea45ca9be9ed7e54f","files_changed":["drizzle/0002_wave2_additive.sql","package-lock.json","package.json","scripts/run-tests.mjs","src/app/admin/events/[eventId]/notifications/page.tsx","src/app/admin/events/[eventId]/requests/page.tsx","src/app/admin/events/[eventId]/roster-import/page.tsx","src/app/admin/layout.tsx","src/lib/admin-nav.ts","src/lib/db/schema.ts","src/lib/spreadsheet-safe.test.ts","src/lib/spreadsheet-safe.ts"],"verify_cmd":"npm run lint && npx tsc --noEmit && npm test && npm run build; xlsx runtime/lock verification; tracked workbook parse; guarded local migration application","verify_result":{"passed":true,"output_tail":"All four required gates passed. xlsx runtime reported 0.20.3; tracked workbook parsed 218 rows. Wave 2 migration applied cleanly to the dedicated localhost database, created all 7 tables, preserved all 11 original-table row counts, and installed the intended partial predicate. Worktree is clean after commit."},"blockers":["xlsx lock integrity: present — \"integrity\": \"sha512-oLDq3jw7AcLqKWH2AhCpVTZl8mf6X2YReP+Neh0SJUzV/BdZYjth94tG5toiMB1PPrYtxOCfaoUCkvtuH+3AJA==\"; resolved URL is https://cdn.sheetjs.com/xlsx-0.20.3/xlsx-0.20.3.tgz.","Drizzle expressed the partial unique index directly as uniqueIndex(\"attorney_reschedule_requests_active_unique\").on(table.assignmentId).where(sql`...`); no SQL divergence.","Table exports: export const rosterImports = pgTable(...); export const rosterImportRows = pgTable(...); export const rosterImportCandidates = pgTable(...); export const attorneyResumeReferences = pgTable(...); export const attorneyRescheduleRequests = pgTable(...); export const notificationBatches = pgTable(...); export const notificationRecipients = pgTable(...).","Spreadsheet exports: export function readCellText(cell: unknown, opts?: { maxLength?: number }): string; export function escapeForSpreadsheet(value: string): string; export function isSafeExternalUrl(raw: string): boolean; export const MAX_UPLOAD_BYTES = 5 * 1024 * 1024; export const MAX_UPLOAD_ROWS = 5000.","Admin layout still has the latest event ID in scope through getEventId(); all three event-scoped links were added, and the layout is explicitly force-dynamic."]}