{"status":"done","branch":"codex/w1-integration-corrections","commit":"5a3cf2585b4c5fc3000ff9c91bd736f8c4cb5810","files_changed":["scripts/apply-local-attorney-auth-migration.ts","scripts/w1-corrections.test.ts","src/app/admin/events/[eventId]/attorneys/actions.ts","src/app/api/attorneys/[id]/resume/route.ts","src/app/attorney/auth.ts","src/app/attorney/callback/route.ts","src/app/attorney/login/page.tsx","src/app/attorney/login/request/route.ts","src/app/attorney/page.tsx","src/app/attorney/safe-logging.ts","src/app/portal/schedule/data.ts","src/app/portal/schedule/practice-display.ts","src/app/portal/schedule/review/page.tsx","src/lib/auth.ts","src/lib/practice-areas.ts","src/lib/staff-authorization.ts","src/proxy.ts"],"verify_cmd":"W1_TEST_ENV_FILE=/Users/thingy/Documents/Codex/2026-09-03/github-plugin-github-openai-curated-remote/work/release-preflight/.env.w1-corrections.local node --import tsx scripts/apply-local-attorney-auth-migration.ts && npm run lint && npx tsc --noEmit && W1_TEST_ENV_FILE=/Users/thingy/Documents/Codex/2026-09-03/github-plugin-github-openai-curated-remote/work/release-preflight/.env.w1-corrections.local node --no-warnings --experimental-test-module-mocks --import tsx --test --test-force-exit --test-concurrency=1 scripts/w1-corrections.test.ts","verify_result":{"passed":true,"output_tail":"Guarded local migration applied at 127.0.0.1:55432. Lint passed. TypeScript passed. Focused suite: 9 tests passed, 0 failed or skipped. Worktree clean after commit."},"blockers":["Root release dependency: configure and verify CLERK_ADMIN_ORG_ID, ATTORNEY_SESSION_SECRET, ATTORNEY_EMAIL_TRANSPORT, RESEND_API_KEY, ATTORNEY_EMAIL_FROM, and NEXT_PUBLIC_APP_URL. No production connection, delivery, or deployment was performed.","The root ClerkProvider layout was intentionally unchanged because production Clerk configuration is present; root should retain stale-Clerk-cookie attorney rendering in release acceptance. No owned-path API dependency remains."]}