{"status":"done","branch":"codex/w1a-onboarding","commit":"9f6a40ed0fa95c0c93fbd88e49ef20a5cb885f5f","files_changed":["src/app/admin/events/[eventId]/attorneys/actions.ts","src/app/admin/events/[eventId]/attorneys/attorney-form.tsx","src/app/admin/events/[eventId]/attorneys/attorney-manage-dialog.tsx","src/app/admin/events/[eventId]/attorneys/attorney-search.tsx","src/app/portal/actions.ts","src/app/portal/page.tsx","src/lib/practice-areas.ts"],"verify_cmd":"npm run lint && npx tsc --noEmit","verify_result":{"passed":true,"output_tail":"ESLint and TypeScript completed successfully. Focused practice-area compatibility checks and the environment-backed Next.js production build also passed; final CodeRabbit review returned zero findings."},"blockers":["Availability error root cause (resolved): the day/time-slot selects were not required, so submitting without a selection sent an empty ID; the server action then threw a bare Error, producing an unhandled error instead of inline feedback."]}