{"status":"done","branch":"codex/w2c-notifications","commit":"cc34ff60092c14cd722c8ca62d048e3c4a93e25d","files_changed":["src/app/admin/events/[eventId]/assignments/page.tsx","src/app/admin/events/[eventId]/notifications/actions.ts","src/app/admin/events/[eventId]/notifications/notification-controls.tsx","src/app/admin/events/[eventId]/notifications/page.tsx","src/app/api/admin/export/schedule/route.ts","src/app/globals.css","src/lib/email/capture.ts","src/lib/email/index.ts","src/lib/email/resend.ts","src/lib/email/templates/schedule-announcement.ts","src/lib/email/types.ts","src/lib/notifications/data.ts","src/lib/notifications/email-safety.test.ts","src/lib/notifications/mail-merge.test.ts","src/lib/notifications/mail-merge.ts","src/lib/notifications/preview.test.ts","src/lib/notifications/preview.ts","src/lib/notifications/service.integration-fixture.ts","src/lib/notifications/service.integration.test.ts","src/lib/notifications/service.ts","src/lib/notifications/surfaces.test.ts","src/lib/notifications/types.ts"],"verify_cmd":"npm run lint && npx tsc --noEmit && npm test && COUNSEL_TEST_ENV_FILE=/Users/thingy/Documents/Codex/2026-09-03/github-plugin-github-openai-curated-remote/work/release-preflight/.env.w2-notifications.local npm test && npm run build","verify_result":{"passed":true,"output_tail":"Lint and strict TypeScript passed. Default tests: 18 passed, 1 isolated-DB test skipped. Local capture/DB tests: 19 passed, 0 failed. Next.js production build passed and emitted all notification, export, schedule, and Wave 2 routes. One CodeRabbit pass reviewed all 22 files; its 1 major and 3 minor findings were fixed before the final successful gate."},"blockers":["Required environment key names: ATTORNEY_EMAIL_TRANSPORT, ATTORNEY_EMAIL_FROM, NEXT_PUBLIC_APP_URL, and RESEND_API_KEY when using Resend. No values were recorded.","Transport API found: EmailTransport.send(EmailMessage): Promise<void>. Narrow extension: optional EmailMessage.idempotencyKey, Promise<EmailSendResult> with messageId, EmailDeliveryError retryability, and shared sendEmail plumbing. Resend now forwards Idempotency-Key, returns the provider id, and distinguishes retryable errors; capture returns a synthetic capture id while remaining impossible in production. No second mail implementation was added.","The export emits max(9, the event's actual confirmed-interview maximum) groups, with no fixed upper cap. Groups 1–9 preserve the tracked workbook order and names, and Overflow_Count identifies interviews beyond group 8.","Could not verify without a provider account: live Resend credentials, sender-domain acceptance, real inbox delivery, provider-issued receipt behavior, or live provider idempotency behavior. No real email was sent. Navigation verification found no missing Wave 2 admin route."]}