{"status":"done","branch":"codex/w2b-attorney-schedule","commit":"f4479385cc3f90eef352be9db81a6391b3aae1fb","files_changed":["src/app/admin/events/[eventId]/assignments/actions.ts","src/app/admin/events/[eventId]/requests/actions.ts","src/app/admin/events/[eventId]/requests/page.tsx","src/app/admin/events/[eventId]/requests/request-review.tsx","src/app/attorney/(portal)/layout.tsx","src/app/attorney/(portal)/requests/actions.ts","src/app/attorney/(portal)/requests/data.ts","src/app/attorney/(portal)/requests/page.tsx","src/app/attorney/(portal)/requests/request-controls.tsx","src/app/attorney/(portal)/schedule/data.ts","src/app/attorney/(portal)/schedule/page.tsx","src/app/attorney/(portal)/schedule/print-button.tsx","src/app/attorney/page.tsx","src/app/page.tsx","src/lib/reschedule.test.ts","src/lib/reschedule.ts"],"verify_cmd":"npm run lint && npx tsc --noEmit && npm test && npm run build && COUNSEL_TEST_ENV_FILE=/Users/thingy/Documents/Codex/2026-09-03/github-plugin-github-openai-curated-remote/work/release-preflight/.env.w2-attorney.local npm test","verify_result":{"passed":true,"output_tail":"Lint and strict TypeScript passed. Unconfigured tests passed with the database test safely skipped. Next.js build passed with all attorney/admin routes dynamic. Dedicated localhost PostgreSQL tests passed 8/8, including closed-event atomic resolution, both uniqueness conflicts with byte-identical preservation, ten concurrent duplicate requests, booking survival, transition rules, and superseded history. One staged CodeRabbit review ran; all two major and three minor findings were fixed. Worktree is clean."},"blockers":["Attorney identity API found: getAttorneyIdentity(): Promise<AttorneyIdentity | null>, where AttorneyIdentity is { role: \"attorney\"; attorneyId: string; eventId: string }. The expected requireAttorney() export was absent, so the authenticated route-group layout calls getAttorneyIdentity() and redirects fail-closed without editing src/lib/auth.ts.","The existing resume route already handled attorneys with an explicit identity.attorneyId === requested id check plus event binding. It was linked and tested without modification. Controlled results were 403 for another attorney id and 404 for malformed/missing-resume cases; successful own-PDF delivery was not exercised because the synthetic fixture had no stored resume file.","Final atomic CTE: target AS MATERIALIZED locks the active request and matching assignment with same-event attorney/company/day predicates; moved conditionally updates one confirmed assignment to a different same-event, available slot; resolved depends on moved and closes that same request. Both counts must equal one. Local PostgreSQL verified that each assignment uniqueness violation aborts the whole statement and leaves both rows byte-identical, while a valid move updates both rows.","Not exercised: actual Neon HTTP write/race behavior because no disposable Neon database was provided and production writes were prohibited; visual 375 px and Letter-print inspection because no browser backend was connected; full HTTP-level ten-request concurrency and successful-resolution appearance across company/staff printable pages. Local HTTP did verify the public attorney link, magic-link session, attorney navigation/logout/print controls, bound schedule, and absence of staff-note and unavailability sentinels from both HTML and RSC payloads."]}